term,acronym,definition,reference,alternative_definition,reference_alternative_definition,status,comment,glossary_reporting,glossary_observers,glossary_TRUEs,glossary_compliance,glossary_science,glossary_mse,glossary_EM
Lift nets,,"a lift net is a horizontal netting panel or bag shaped like a parallelepiped, pyramid or cone with the opening facing upwards which are submerged at a certain depth, left for a while, the time necessary for light or bait to attract fish over the opening",data reference catalogue fishery categories,,,,,TRUE,TRUE,TRUE,TRUE,TRUE,TRUE,
Line fishing,,"a general term used for a range of fishing methods that employ fishing lines in one form or another (as opposed to nets and traps). It includes handlines, hand reels, powered reels, pole-and-line, droplines, longlines, trotlines and troll lines",FAO terminology portal,,,,,TRUE,TRUE,TRUE,TRUE,TRUE,TRUE,
Line hauler (branchline),,a branch line hauler/coiler winds branch lines into tight,draft of observer manual,,,,,TRUE,TRUE,TRUE,TRUE,TRUE,TRUE,
Line setter,,,,,,To define,missing reference,TRUE,TRUE,TRUE,TRUE,TRUE,TRUE,
Live weight equivalent,,weight derived from the landed or product weight by the application of certain factors and designed to represent the actual weight of the fishery product as it was taken from the water and before being subjected to any processing or other operations ([Eurostat](https://ec.europa.eu/eurostat/statistics-explained/index.php?title=Glossary:Live_weight_of_fishery_products#:~:text=Live%20weight%20of%20fishery%20products%20is%20derived%20from%20the%20landed,IOTC data reporting guidelines,,,,,TRUE,TRUE,TRUE,TRUE,TRUE,TRUE,
Longline,,"a fishing gear in which short lines carrying hooks are attached to a longer main line at regular intervals. Longlines are laid on the bottom or suspended horizontally at a predetermined depth with the help of surface floats. The main lines can be as long as 150 km and have several thousand hooks (e.g. in tuna fisheries),Longline",FAO terminology portal,,,,,TRUE,TRUE,TRUE,TRUE,TRUE,TRUE,
Longline fisheries,,"fishery undertaken by vessels recorded in the IOTC Record of Authorised Vessels that use a longline gear (Res. [15/02](https://www.iotc.org/cmm/resolution-1502-mandatory-statistical-reporting-requirements-iotc-contracting-parties-and)),Longline fisheries",data reporting guidelines,,,,,TRUE,TRUE,TRUE,TRUE,TRUE,TRUE,
Longline section,,,reference,,,to define,,TRUE,TRUE,TRUE,TRUE,TRUE,TRUE,
Lower-jaw fork length,,"length of a fish measured as the distance between the tip of the lower jaw and the point of the fork or ŌĆśVŌĆÖ of the tail. Commonly used to record the length of commercial fish with bills (e.g. swordfish) because it is little affected by damage to the tail fin (c.f. Total length) and bill. Fork length is measured flat, from point to point, not by stretching a tape along the body surface",IOTC glossary,,,,,TRUE,TRUE,TRUE,TRUE,TRUE,TRUE,
Magnetic compass,,"is dependent on the earth's magnetic field, and will point to the Magnetic North. To some extent the magnetic fields of the vessel and equipment surrounding a magnetic compass also affect the direction shown by a magnetic compass.",observer manual 2019,,,,,,,,,,,
Main body,,"The main body of the net extends from one end to the other end of the net, except the bunt region. It is the largest part of the net and facilitates surrounding of the fish shoal during operations. It is made by joining together large sections of netting of appropriate mesh sizes to catch the target fish. The material used should have high specific gravity to increase the sinking speed during setting. Twisted knotless netting and ""Raschel"" braided netting are lighter and are widely used for purse seines. Knotted net is more recently preferred over knotless net, because of the difficulty to repair knotless net when damaged.Ā",observer manual 2019,,,,,,,,,,,
Mainline,,"longline fishing gear consists of a mainline kept near the surface or at a particular depth by means of regularly spaced floats or weights. Branchlines with baited hooks are attached to the mainline at regular intervals,Mainline",IOTC glossary,,,,,TRUE,TRUE,TRUE,TRUE,TRUE,TRUE,
Mate,,The mate is also a ticketed officer second in command to the Captain and is often in charge of the fishing operations on the deck.Ā,observer manual 2019,,,,,,,,,,,
Mechanized setting,,"the gear is mechanised, e.g.",gear configuration code list,,,,,TRUE,TRUE,TRUE,TRUE,TRUE,TRUE,
Medium-scale fisheries,,"fish is caught in areas beyond national jurisdiction (ABNJ) of the flag state, by vessels with a length overall less than 24 m, and sold at landing sites, at markets, to processing factories",fishery types code list,,,,,TRUE,TRUE,TRUE,TRUE,TRUE,TRUE,
Medium-scale fishery,,"the medium scale fishery is generally understood to be a fishery undertaken by powered boats and with small or medium size capital,Medium-scale fishery",FAO terminology portal,,,,,TRUE,TRUE,TRUE,TRUE,TRUE,TRUE,
Meridians,,are half circles passing through the poles and perpendicular to the equator,observer manual 2019,,,,,,,,,,,
Mess hall,,"The ""mess hall"" is a term sometimes used for the dining room on board where the crew eats and can relax.Ā",observer manual 2019,,,,,,,,,,,
MF & HF (for radios),,for communication over longer distances over 1000 miles,observer manual 2019,,,,,,,,,,,
Monitoring,,"the requirement for the continuous collection of fishery-related data,Monitoring",EM workshop and resolution 23/08,,,,,TRUE,TRUE,TRUE,TRUE,TRUE,TRUE,
Monsoon,,"is a seasonal reversal in the prevailing wind direction and weather. A warm air mass with low pressure at the surface forms over the continent as it is warmed by the sun. Air from the relatively cooler and higher pressure air mass over the ocean then flows toward the low pressure over land. In winter this process is reversed as the air over the land becomes cooler, developing into a high pressure and winds blow off-shore towards the low pressure caused by the relatively warmer ocean. These conditions also influence the strength and direction of coastal currents",observer manual 2019,,,,,,,,,,,
Multiple random sampling,,,reference,,,,,TRUE,TRUE,TRUE,TRUE,TRUE,TRUE,
National jurisdiction areas,,vessels operate exclusively within areas under national jurisdiction of their flag state (territorial sea,areas of operation code list,,,,,TRUE,TRUE,TRUE,TRUE,TRUE,TRUE,
National jurisdiction areas and beyond,,vessels operate in areas under national jurisdiction as well as in areas beyond national jurisdiction of their flag state (i.e.,areas of operation code list,,,,,TRUE,TRUE,TRUE,TRUE,TRUE,TRUE,
Nautical twilight,,"at dawn starts when the sun is 12 degrees below the horizon and ends when the sun is 6 degrees below the horizon. In the evening nautical twilight starts when the sun is 6 degrees below the horizon and ends when the sun is 12 degrees below the horizon,Nautical twilight",ROS observer manual,,,,,TRUE,TRUE,TRUE,TRUE,TRUE,TRUE,
NAVTEX,,"a component of GMDSS: an international, automated system for instantly distributing maritime navigational warnings, weather forecasts and warnings",ROS observer manual,,,,,TRUE,TRUE,TRUE,TRUE,TRUE,TRUE,
Neritic,,"designating, or of",ROS scientific observer,,,,,TRUE,TRUE,TRUE,TRUE,TRUE,TRUE,
Net drum hauler,,,,,,,missing reference,TRUE,TRUE,TRUE,TRUE,TRUE,TRUE,
Net tonnage,,"dimensionless measure of the useful capacity of a ship ([Thermes et al. 2023](https://www.fao.org/fishery/en/publications/278529)),Net tonnage",IOTC data reporting guidelines,,,,,TRUE,TRUE,TRUE,TRUE,TRUE,TRUE,
Nominal catches,,"officially declared aquatic organisms captured during fisheries and expressed as live weight equivalent. Nominal catches do not include unreported catches, such as unreported discards",([Eurostat](https://ec.europa.eu/eurostat/statistics-explained/index.php?title=Glossary:Nominal_catch)),,,,,TRUE,TRUE,TRUE,TRUE,TRUE,TRUE,
Non-mechanized setting,,"the gear is not mechanised, i.e.",gear configuration code list,,,,,TRUE,TRUE,TRUE,TRUE,TRUE,TRUE,
Non-target species,,species for which the fishing gear is not specifically deployed or set,FAO terminology portal,,,,,TRUE,TRUE,TRUE,TRUE,TRUE,TRUE,
Observer,,"means a person who collects information on board fishing vessels, in the framework of observer programs, and can be used inter alia for monitoring fishing activities, quantifying species composition of target species and bycatch",Resolution 25/06,,,,,TRUE,TRUE,TRUE,TRUE,TRUE,TRUE,
Offal,,"the viscera and trimmings of a butchered animal removed in preparing it for market or for consumption,Offal",Webster dictionary definition,,,,,TRUE,TRUE,TRUE,TRUE,TRUE,TRUE,
Onboard interface/screen,,"An on-board screen, or equivalent interface, to allow verification by the Master/crew of the correct functioning of the system, is required. (OR) The onboard interface shall include an on- board screen, or equivalent interface, to allow verification by the skipper/crew on correct functioning of EM equipment.",EM workshop standards,,,,,TRUE,TRUE,TRUE,TRUE,TRUE,TRUE,
Operational buoy,,"any instrumented buoy, previously activated, switched on and deployed at sea on a drifting FAD or log",(Res. [19/02](https://iotc.org/cmm/resolution-1902-procedures-fish-aggregating-devices-fads-management-plan)),,,,,TRUE,TRUE,TRUE,TRUE,TRUE,TRUE,
Pelagic,,"inhabiting surface waters rather than the sea floor. Usually applied to free-swimming species such as tunas and sharks,Pelagic",data reporting guidelines,,,,,TRUE,TRUE,TRUE,TRUE,TRUE,TRUE,
Pelagic,,"Relating to, living or occurring in the open sea.",FAO terminology portal,,,,,TRUE,TRUE,TRUE,TRUE,TRUE,TRUE,
Pole-and-line fishing,,"a fishing technique in which surface schooling fish are attracted to the vessel and driven into very active feeding behaviour by throwing live or dead bait into the water and spraying water onto the sea surface to simulate the escape behaviour of small preys. The fish lured with a line and a hook attached to a pole and pulled off the water by manual or powered devices,Pole-and-line fishing",([FAO fishery glossary](https://www.fao.org/faoterm/en/)),,,,,TRUE,TRUE,TRUE,TRUE,TRUE,TRUE,
Pole-and-lines,,a pole-and-line consists of a hooked line attached to a pole. This method is common to sport fisheries (angling) but it is also used in commercial fisheries. Fishing rods/poles are made of wood (including bamboo,IOTC data catalogue fishery categories,,,,,TRUE,TRUE,TRUE,TRUE,TRUE,TRUE,
Pool of observers,,"means a list of IOTC recognised observers that have been allocated an IOTC registration number and trained according to IOTC standards who may be called upon by other flag States,Pool of observers",IOTC Resolution 25/06,,,,,TRUE,TRUE,TRUE,TRUE,TRUE,TRUE,
Port,,"If you stand in the centre of the vessel and face the bows the side on your left is the ""port"" side.Ā",observer manual 2019,,,,,,,,,,,
Port of registration,,The port of registration is normally written across the stern below the vessels name.Ā,observer manual 2019,,,,,,,,,,,
Power block,,A hydraulic power block attached to the end of an extended boom is used to haul the net back and restack it in at the stern of the vessel ready for the next set.Ā,observer manual 2019,,,,,,,,,,,
Prim,,serves as a reference to locate the other meridians. It passes through greenwich (London Observatory),observer manual 2019,,,,,,,,,,,
Propeller,,Propels the vessel through the water.Ā,observer manual 2019,,,,,,,,,,,
Purse line,,"steel wire rope that is housed on the ""purse winches"" Most seiners have purse lines at least 10 - 20 % longer than the total length of their seines. The purse line is passed through the metal rings [purse rings or ringbolts], which, when drawn on, cinches (purses) the lower portion of the net closed to trap the fish from below. To close the net, at the bottom, there is a series of or ringbolts held by a chain running from strut to strut, through which a steel cable runs, known as the lacing.Ā",observer manual 2019,,,,,,,,,,,
Purse seine,,"nets characterized by the use of a purse line at the bottom of the net. The purse line enables the net to be closed like a purse and thus retain all the fish caught,Purse seine",([N├®d├®lec and Prado 1990](https://www.fao.org/3/t0367t/t0367t00.htm)),,,,,TRUE,TRUE,TRUE,TRUE,TRUE,TRUE,
Purse seine,,"a purse seine is made of a long wall of netting framed with floatline and leadline (usually, of equal or longer length than the former) and having purse rings hanging from the lower edge of the gear",FAO terminology portal,,,,,TRUE,TRUE,TRUE,TRUE,TRUE,TRUE,
Purse seine,,"nets characterized by the use of a purse line at the bottom of the net. The purse line enables the net to be closed like a purse and thus retain all the fish caught. The purse seines, which may be very large, are operated by one or two boats. The most usual case is a purse seine operated by a single boat",FAO terminology portal,,,,,TRUE,TRUE,TRUE,TRUE,TRUE,TRUE,
Purse seine bunt,,,,,,to define,,TRUE,TRUE,TRUE,TRUE,TRUE,TRUE,
Purse seine tackle,,is made up of a trapezoid shaped net consisting of a series of horizontal and vertical panels with different sized mesh nets making up different parts of the gear.,observer manual 2019,,,,,,,,,,,
Purse seining,,"harvesting of surface-schooling pelagic fish by surrounding the school with a net. A line that passes through rings on the bottom of the net can be tightened to close the net so that the fish cannot escape,Purse seining",IOTC glossary,,,,,TRUE,TRUE,TRUE,TRUE,TRUE,TRUE,
Radar,,"radar sends out and receives radio waves horizontally from the vessel. When the radio waves reflect off objects the reflection is shown on the radar screen. These can show the real-time position of objects around a vessel in darkness of in fog when they cannot normally be seen visually,Radar",ROS observer manual,,,,,TRUE,TRUE,TRUE,TRUE,TRUE,TRUE,
Radar,,"short for radio detection and ranging. A system of detecting and locating targets which are capable of reflecting high frequency radio waves (microwaves),Radar",FAO terminology portal,,,,,TRUE,TRUE,TRUE,TRUE,TRUE,TRUE,
Reactivation,,"the act of re-enabling satellite communications services by the buoy supplier company at the request of the buoy owner or manager,Reactivation",ROS observer program,,,,,TRUE,TRUE,TRUE,TRUE,TRUE,TRUE,
Regional agency,,"a regional or sub- regional organisation that may support CCM national EM Programs and EM Systems,Regional agency",EM standards-WCPFC term,,,,,TRUE,TRUE,TRUE,TRUE,TRUE,TRUE,
Registration number,,The registration number is written below the name on the bows.Ā,observer manual 2019,,,,,,,,,,,
Retained catches,,"estimated component of the catch which is retained on board during a fishing trip,Retained catches",([CWP](https://www.fao.org/cwp-on-fishery-statistics/handbook/capture-fisheries-statistics/catch-and-landings/en/)),,,,,TRUE,TRUE,TRUE,TRUE,TRUE,TRUE,
Review for data quality,,"the verification process of re- analysing/interpreting a portion of previously analysed EM records to determine completeness, adherence to protocols",EM workshop-WCPFC term,,,,,TRUE,TRUE,TRUE,TRUE,TRUE,TRUE,
Ring nets,,"a ring net is a net the form of which is intermediate hybrid between a purse seine and a lamapara net: like on a purse seine, rings at the lower edge of the net, allow using a purse line to close it under the fish (pursing) and like on a lampara net",gear code lists,,,,,TRUE,TRUE,TRUE,TRUE,TRUE,TRUE,
Round weight,,"weight of the whole fish before processing or removal of any part,Round weight",([FAO fishery glossary](https://www.fao.org/faoterm/en/)),,,,,TRUE,TRUE,TRUE,TRUE,TRUE,TRUE,
Rudder,,Used to steer the vessel.Ā,observer manual 2019,,,,,,,,,,,
SART,,a component of GMDSS: These devices may be either a radar-SART (Search and Rescue Transponder),ROS observer manual,"These devices may be either a radar-SART (Search and Rescue Transponder), or an AIS-SART (AIS Search and Rescue Transmitter) are used to locate survival craft or distressed vessels by creating a series of dots on a rescuing ship's 3 cm radar display",observer manual 2019,,,TRUE,TRUE,TRUE,TRUE,TRUE,TRUE,
Scupper,,"A scupper is the ""gutter"" on the side of the deck that allows the water from the deck to run-off directly over the side back into the sea.Ā",observer manual 2019,,,,,,,,,,,
Sea Area A1,,An area within the radiotelephone coverage of at least one VHF coast station in which continuous digital selective calling (ch70) alerting and radiotelephony services are available. Such an area could extend typically 30 to 50 Nautical miles from the Coast Station.,observer manual 2019,,,,,,,,,,,
Sea Area A2,,"An area, excluding Sea Area A1, within the radiotelephone coverage of at least one MF coast station in which continuous DSC (2187.5 kHz) alerting and radiotelephony services are available. For planning purpose this area typically extends to up to 150 nautical miles offshore, but would exclude any A1 designated areas.Ā In practice, satisfactory coverage may often be achieved out to around 400 Nautical miles offshore.",observer manual 2019,,,,,,,,,,,
Sea Area A3,,"An area, excluding sea areas A1 and A2, within the coverage of an INMARSAT geostationary satellite in which continuous alerting is available. This area lies between about latitude 76 Degree NORTH and SOUTH, but excludes A1 and/or A2 designated areas.",observer manual 2019,,,,,,,,,,,
Sea Area A4,,"An area outside sea area A1, A2 and A3 is called Sea Area A4. This is essentially the POLAR Region, NORTH and SOUTH of about 76 Degree of Latitude, but excludes any other areas.",observer manual 2019,,,,,,,,,,,
Sea direction,,"is expressed as the direction from which the sea is coming.Ā Cardinal points or degrees are also used to record the direction of the sea, similar to wind direction.Ā",observer manual 2019,,,,,,,,,,,
Sea height,,is expressed in meters and is the height from the trough to the crest of the wave.Ā This height need to be estimated by the Observer. One method is to look at an object on the sea surface (for example a bird or white patch from a recently broken wave) and watch it move as a number of waves pass and attempt to estimate the height of its vertical movement.Ā,observer manual 2019,,,,,,,,,,,
Sea waves,,are waves generated locally by the prevailing wind and move in the same direction as the surface wind. Larger wind waves often break and have foaming crests.,observer manual 2019,,,,,,,,,,,
SelvedgesĀ / guarding,,"strips of strong netting and are used for strengthening the main netting and to protect it from damage during operations. It is provided in the upper, lower and side edges of the main body of the net. It consists of few rows of large meshes of thicker twine. The upper selvedge is attached to the float line also called the head rope and the lower selvedge to the lead line or chain foot rope as chain reinforcement. It is also attached to the side ropes or gavel lines. Lead line is usually longer than float line by 10 %.",observer manual 2019,,,,,,,,,,,
Semi-industrial fishery,,"fishery that (i) catches fish from medium- (and/or small-) sized vessels fitted out with mechanised methods of operating the fishing gear, (ii) process the catch in land bases, and (iii) distributed the fish and fish products around a limited area, and in exceptional cases only for export. These activities are aimed at the financial benefit of the companies or organisations operating the fishing vessels, processing plants",([Thermes et al. 2023](https://www.fao.org/fishery/en/publications/278529)),,,,,TRUE,TRUE,TRUE,TRUE,TRUE,TRUE,
Semi-industrial fishing vessel,,"medium-sized vessel, typically of 12 m in length but less than 24 m in length, engaged in catching operations",([Thermes et al. 2023](https://www.fao.org/fishery/en/publications/278529)),,,,,TRUE,TRUE,TRUE,TRUE,TRUE,TRUE,
Semi-industrial fishing vessel (IOTC),,commercial fishing vessel of length overall comprised between 15 and 24 m and exclusively operating in the exclusive economic zone of the flag state,([IOTC-2023-WPDCS19-07_Rev1](https://iotc.org/documents/WPDCS/19/07)),,,,,TRUE,TRUE,TRUE,TRUE,TRUE,TRUE,
Sensors ,,"EM systems may be equipped with a variety of integrated sensors that can provide additional information on fishing activity, trigger activation or adjustment of configurations of cameras",EM workshop,,,,,TRUE,TRUE,TRUE,TRUE,TRUE,TRUE,
Set gillnets,,"a set gillnet is a long rectangular netting anchored or otherwise fixed to the seabed to catch fish when they come in contact with it. The set gillnet is held open vertically in the water by a headrope usually with floats, and by a footrope weighted with sinkers. Floatation and weight may be built into ropes, which are usually called floatrope and leadrope respectively. The net is kept in position by anchors or other weights, usually at both ends",IOTC reference fish categories,,,,,TRUE,TRUE,TRUE,TRUE,TRUE,TRUE,
Set longline,,"longlines consist of a main line, sometimes of considerable length",FAO terminology portal,,,,,TRUE,TRUE,TRUE,TRUE,TRUE,TRUE,
Shallow setting,,"the gear is deployed at a shallow depth,Shallow setting",gear configuration code lists,,,,,TRUE,TRUE,TRUE,TRUE,TRUE,TRUE,
Shark lines,,,,,,to define,,TRUE,TRUE,TRUE,TRUE,TRUE,TRUE,
Sinker,,a weight used to sink a fishing line or net,FAO terminology portal,,,,,TRUE,TRUE,TRUE,TRUE,TRUE,TRUE,
Size frequency,,"the number of individuals in a catch or catch sample in each group of sizes (size intervals),Size frequency",IOTC data reporting guidelines,,,,,TRUE,TRUE,TRUE,TRUE,TRUE,TRUE,
Skif,,"Powerful boat of 8m with an engine of 600CV, used to assist in setting the net around a school of fish.Ā",observer manual 2019,,,,,,,,,,,
Small-scale fishery,,"fishery characterised in most cases by fishing vessels with non-mechanized propulsion systems (sails and oars) or low-horsepower outboard or inboard engines, use of passive fishing methods, manual operation of fishing gear (setting, shooting and hauling) and the absence of electronic fish-finding and navigational devices ([Tietze et al. 2000](https://www.fao.org/3/x8294e/X8294E00.htm)). From a socio-economic perspective, small-scale fisheries can be broadly categorised as a dynamic and evolving sector employing labour intensive harvesting, processing and distribution technologies to exploit marine and inland water fishery resources. The activities of this sub-sector, conducted full-time or part-time, or just seasonally, are often targeted on supplying fish and fishery products to local and domestic markets",IOTC data reporting guidelines,,,,,TRUE,TRUE,TRUE,TRUE,TRUE,TRUE,
Sonar,,"an apparatus that uses sound waves to detect objects underwater by measuring or classifying the echoes received from them. An echo sounder is a sonar that transmits vertically. In practice, a sonar is an apparatus other than an echo sounder, i.e.",FAO terminology portal,,,,,TRUE,TRUE,TRUE,TRUE,TRUE,TRUE,
Species of special interest,,"species of Special Interest include all marine turtles, all marine mammals, all seabirds, shark species with a retention ban: whale sharks (Res 13/05), oceanic white tip sharks (Res 13/06) and thresher sharks (Res 12/09.); and billfish species included in Res 18/05: striped",ROS observer manual,,,,,TRUE,TRUE,TRUE,TRUE,TRUE,TRUE,
Standard length,,"the length of fish measured in a straight line from the tip of the snout to the end of the caudal skeleton,Standard length",FAO terminology portal,,,,,TRUE,TRUE,TRUE,TRUE,TRUE,TRUE,
Starboard,,"If you stand in the centre of the vessel and face the bows the side on your right hand is the ""starboard"" side.Ā",observer manual 2019,,,,,,,,,,,
Stow nets,,"a stow net is a stationary gear made from netting, usually in the form of a cone or pyramid. Stow nets can be fixed for a long time at the same place in rows. These nets are fixed by means of anchors or stakes, placed according to the direction and strength of the current. The mouths are sometimes held open by a frame",gear code lists,,,,,TRUE,TRUE,TRUE,TRUE,TRUE,TRUE,
Stratefied sampling,,,,,,to define,,TRUE,TRUE,TRUE,TRUE,TRUE,TRUE,
Streamer line,,a line with streamers,FAO terminology portal,,,,,TRUE,TRUE,TRUE,TRUE,TRUE,TRUE,
Subsistence fishery,,"fish is caught in national jurisdiction areas (NJA) of the flag state, by vessels with a length overall of less than 15 m",fishery types code list,,,,,TRUE,TRUE,TRUE,TRUE,TRUE,TRUE,
Sub-surface setting,,"the gear is deployed beyond the surface of the water,Sub-surface setting",gear configuration code lists,,,,,TRUE,TRUE,TRUE,TRUE,TRUE,TRUE,
Sunrise,,"is the time in the morning when the first part of the sun appears above the horizon,Sunrise",ROS observer manual,,,,,TRUE,TRUE,TRUE,TRUE,TRUE,TRUE,
Sunset,,"is the time in the evening when last part of the sun disappears below the horizon,Sunset",ROS observer manual,,,,,TRUE,TRUE,TRUE,TRUE,TRUE,TRUE,
Superstructure,,"A deck on a vessel is the horizontal partitioning of the vessel. The main deck is the most continuous deck above the water line running from the bows to the stern.Ā All decks below the main deck are termed ""lower decks"" and all decks above the main deck are called ""upper decks"" or form part of the ""super structure"".Ā",observer manual 2019,,,,,,,,,,,
Supply vessel,,"any vessel used, equipped to be used or intended to be used for purse seine fishing related activities, including any vessel, other than a craft, carried on board a fishing vessel that is not equipped with operational fishing gear and that facilitates",IOTC-2025-CoC22-11_Add4-IOTC Glossary,,,,,TRUE,TRUE,TRUE,TRUE,TRUE,TRUE,
Support vessel,,"non-fishing vessel supporting fishing operations and in particular assisting purse seine fishing vessels in the location of tuna schools and in the the deployment, monitoring and retrieving of buoys and drifting fish aggregating devices. Synonym to supply vessel",IOTC data reporting guidelines,,,,,TRUE,TRUE,TRUE,TRUE,TRUE,TRUE,
