term,acronym,definition,reference,alternative_definition,reference_alternative_definition,status,comment,glossary_reporting,glossary_observers,glossary_TRUEs,glossary_compliance,glossary_science,glossary_mse,glossary_EM
Support vessel (fishing support vessel),,"fishing support vessels receive the catch of fishing vessels and supply vessels that bring fuel and provisions to fishing vessels,Support vessel (fishing support vessel)",FAO terminology portal,,,,,TRUE,TRUE,TRUE,TRUE,TRUE,TRUE,
Surface fishery,,"all fisheries operated by vessels in the IOTC Record of Authorized Vessels other than longline fisheries; in particular purse seine, pole-and-line, gillnet fisheries",data catalogue ,"fishery undertaken by vessels recorded in the IOTC Record of Authorised Vessels other than longline fisheries; in particular purse seine, pole-and-line, gillnet, handline",(Res. [15/02](https://www.iotc.org/cmm/resolution-1502-mandatory-statistical-reporting-requirements-iotc-contracting-parties-and)),,,TRUE,TRUE,TRUE,TRUE,TRUE,TRUE,
Swell,,are waves that have been generated elsewhere and have travelled out of the area where they were generated and have no relation to the prevailing wind direction. A swell never breaks or has a foaming crest.,observer manual 2019,,,,,,,,,,,
Swell direction and height,,"Swell direction and height is estimated in the same way as determining sea height and direction.Ā However a swell will never break or have a ""white cap"" and has no relation to the prevailing wind.Ā In many cases the swell direction will be different from that of the prevailing sea.Ā If two wave forms are observed and their movement is in the direction of the surface wind, the system, which has the longer distance between crests and a more regular form, is considered to be the swell.Ā",observer manual 2019,,,,,,,,,,,
Systematic proportional sampling,,,,,,To define,no definition in code lists,TRUE,TRUE,TRUE,TRUE,TRUE,TRUE,
Target species,,"those species that are primarily sought by the fishermen in a particular fishery. The subject of directed fishing effort in a fishery. There may be primary as well as secondary target species,Target species",FAO terminology portal,,,,,TRUE,TRUE,TRUE,TRUE,TRUE,TRUE,
Tonnage,,a measure of the size or capacity of a ship,Thermes et al. 2023 (https://www.fao.org/fishery/en/publications/278529),,,,,TRUE,TRUE,TRUE,TRUE,TRUE,TRUE,
Tori line,,line with streamers,IOTC glossary,,,,,TRUE,TRUE,TRUE,TRUE,TRUE,TRUE,
Track plotter,,,,,,to define,,TRUE,TRUE,TRUE,TRUE,TRUE,TRUE,
Trawls,,"a trawl is a cone-shaped net (made from two, four or more panels) which is towed, by one or two boats, on the bottom or in midwater (pelagic). The cone-shaped body ends in a bag or coded. The horizontal opening of the gear while it is towed is maintained by beams",IOTC reporting guidelines glossary,,,,,TRUE,TRUE,TRUE,TRUE,TRUE,TRUE,
Trolling line,,"a line with one or more baited hooks (or lures) towed behind a boat,Trolling line",FAO terminology portal,,,,,TRUE,TRUE,TRUE,TRUE,TRUE,TRUE,
Unfit for human consumption,,"unfit for human consumption are fish that: (1) is meshed or crushed in the purse seine; or (2) is damaged due to depredation; or (3) has died and spoiled in the net where a gear failure has prevented both the normal retrieval of the net and catch, and efforts to release the fish alive.AND  does not include fish that: (1) is considered undesirable in terms of size, marketability",ROS observer manual,,,,,TRUE,TRUE,TRUE,TRUE,TRUE,TRUE,
Uninterruptable power supply (UPS) (EM),,"provides power to the system and enables controlled shutdown in the event of a power loss so as to preserve the security and integrity of data 1,Uninterruptable power supply (UPS) (EM)",EM workshop-WCPFC term only,,,,,TRUE,TRUE,TRUE,TRUE,TRUE,TRUE,
Upper-jaw fork length,,"length of a fish measured as the straight distance between the tip of the upper jaw and the fork of the tail,Upper-jaw fork length",IOTC data reporting guidelines,,,,,TRUE,TRUE,TRUE,TRUE,TRUE,TRUE,
User Interface (EM),,"a display that communicates EM system status messages and provides views of onboard cameras,User Interface (EM)",EM workshop-WCPFC term only,,,,,TRUE,TRUE,TRUE,TRUE,TRUE,TRUE,
Vertical lines,,"a vertical line consists of a line to which is attached sinker and one or several hooks. In commercial fisheries the lines have usually several hooks. The additional hooks can be fixed on the mainline at short intervals with branch lines of a certain length. The line weighed down by sinkers can be set up to 200 m depth and is hauled with jerky movements,Vertical lines",gear code lists,,,,,TRUE,TRUE,TRUE,TRUE,TRUE,TRUE,
Vessel name,,The vessels name is usually written up on the bows and across the stern.  ,observer manual 2019,,,,,,,,,,,
Vessel monitoring plan,,"the vesselŌĆÖs EM equipment characteristics and how the vesselŌĆÖs EM equipment is installed and configured to monitor fishing activities and meet the EM Program and EM Data Standards as required by the IOTC Regional Electronic Monitoring,Vessel monitoring plan",EM workshop,,,,,TRUE,TRUE,TRUE,TRUE,TRUE,TRUE,
Vessel monitoring system,,"a secure satellite-based monitoring system capable of transmitting the position and identity of vessels to the competent authorities,Vessel monitoring system",IOTC-2025-CoC22-11_Add4-IOTC Glossary,,,,,TRUE,TRUE,TRUE,TRUE,TRUE,TRUE,
Vessel Operator,,"any person who is in charge of, directs or controls a vessel",EM workshop-WCFPC term only,,,,,TRUE,TRUE,TRUE,TRUE,TRUE,TRUE,
Very High Frequency radios,VHF,has limited range used for local communications up to approximately 25 miles,,,,to define,,TRUE,TRUE,TRUE,TRUE,TRUE,TRUE,
Vessel Monitoring System,VMS,a satellite-based monitoring system which at regular intervals provides data to fisheries authorities on the location,FAO terminology portal,,,,,TRUE,TRUE,TRUE,TRUE,TRUE,TRUE,
XBT,,,,,,To define,,TRUE,TRUE,TRUE,TRUE,TRUE,TRUE,
